"BROKEN","EPIC","FAILED","FEATURE","PASSED","SKIPPED","STORY","UNKNOWN"
"0","","0","Tarifario","1","0","Consulta de Traslados Completa (Capturas, Modales y Tooltips)","0"
"0","","0","Tarifario","1","0","Consulta de Hoteles Completa (Tags, Tarifas y Modales)","0"
"0","","0","Tarifario","1","0","Consulta de Excursiones Completa (Tarifas, Modales y Tooltips al final)","0"
"0","","1","Tarifario","0","0","Consulta de Cruceros Completa (Tarifas y Modales)","0"
"0","","0","Tarifario","1","0","Consulta de Cenashow Completa (Capturas, Modales y Tooltips)","0"
"1","","0","Tarifario","0","0","Consulta de Paquetes Completa (Tags, Tarifas y Modales)","0"
"1","","0","Tarifario","0","0","Consulta de Ofertas Completa (Modales y Tarifas)","0"
